{
  "$schema": "http://json-schema.org/draft-07/schema#",
  "$id": "https://obsidian.dev/skills/obsidian-mission-lock/input.schema.json",
  "title": "obsidian-mission-lock input envelope",
  "description": "Envelope passed by the Obsidian controller when invoking the skill. Custom project convention (Obsidian Plan), version 1.0.0.",
  "type": "object",
  "required": ["task_id", "project_id", "request", "skill_version", "timestamp"],
  "additionalProperties": false,
  "properties": {
    "task_id": { "type": "string", "minLength": 1, "description": "Unique task identifier (UUID/ULID), generated by the controller" },
    "project_id": { "type": "string", "minLength": 1 },
    "request": { "type": "string", "minLength": 1, "description": "Verbatim natural-language user request" },
    "context": {
      "type": "object",
      "description": "Free-form context. Reserved keys: draft_contract (a contract object for programmatic checking), pathway, matrix (MICP domain)"
    },
    "constraints": { "type": "object", "description": "Named constraints, values string|number|boolean" },
    "evidence_refs": { "type": "array", "items": { "type": "string" }, "description": "URIs/paths/DOIs of evidence the mission may cite" },
    "data_refs": { "type": "array", "items": { "type": "string" } },
    "upstream_outputs": { "type": "array", "items": true, "description": "Outputs from previously run skills" },
    "requested_output_format": { "type": "string", "enum": ["json", "yaml", "markdown"], "default": "json" },
    "risk_level": { "type": "string", "enum": ["low", "medium", "high", "critical"], "default": "low" },
    "human_approval_state": { "type": "string", "enum": ["not_required", "pending", "approved", "rejected"], "default": "not_required" },
    "skill_version": { "type": "string", "pattern": "^\\d+\\.\\d+\\.\\d+$", "description": "Skill version the caller expects; cross-major mismatch without migration is rejected (OML-E1010)" },
    "controller_version": { "type": "string" },
    "timestamp": { "type": "string", "format": "date-time" },
    "prior_contract": { "$ref": "output.schema.json#/$defs/contract", "description": "Previous locked contract when this is a revision request" }
  }
}
